{
  "schemaVersion": 1,
  "status": "draft-read-only",
  "sourceStrategy": [
    "Read-only inspection payload assembled from package and generated-layer fixture metadata.",
    "The Browser consumes the runtime copy as read-only metadata and never instantiates these entries for inspection.",
    "Entries must not require layer instantiation, scene mutation, runtime scanning, or canonical manifest changes."
  ],
  "optionPolicy": {
    "unavailableStoredValue": "preserve-and-mark-unavailable",
    "rewritesStoredValue": false
  },
  "sources": [
    "tools/layer_package_catalog_regression.py",
    "tools/generated_layer_catalog_regression.py",
    "docs/schemas/layer_browser_inspection_payload.schema.json",
    "docs/examples/layer_packages",
    "docs/examples/generated_layers"
  ],
  "counts": {
    "entries": 2,
    "packageEntries": 1,
    "generatedEntries": 1,
    "parameters": 37,
    "presets": 3,
    "mappingPresets": 1,
    "categories": 2,
    "layerGroups": 2
  },
  "categories": {
    "Examples": 1,
    "Generated": 1
  },
  "layerGroups": {
    "Artist SDK": 1,
    "Models": 1
  },
  "kinds": {
    "generated-content-layer": 1,
    "package-layer": 1
  },
  "entries": [
    {
      "assetId": "examples.signal_bloom",
      "label": "Signal Bloom",
      "category": "Examples",
      "layerGroup": "Artist SDK",
      "kind": "package-layer",
      "layerType": "example.signalBloom",
      "registryPrefix": "examples.signal_bloom",
      "source": {
        "kind": "layer-package",
        "path": "docs/examples/layer_packages/signal_bloom/layer.package.json",
        "strategy": "source-registration",
        "sourceRegistrationRequired": true
      },
      "inspection": {
        "manifestInspectionOnly": true,
        "runtimeLoadable": false,
        "requiresInstantiation": false,
        "mutatesScene": false
      },
      "controls": {
        "count": 18,
        "sections": {
          "Color": 6,
          "Force": 1,
          "Input": 3,
          "Motion": 2,
          "Scale": 1,
          "Time": 2,
          "Visibility": 3
        },
        "parameters": [
          {
            "id": "bgColorB",
            "kind": "float",
            "label": "Color: Background Blue",
            "section": "Color",
            "default": 0.08,
            "range": {
              "min": 0.0,
              "max": 1.0,
              "step": 0.01
            }
          },
          {
            "id": "bgColorG",
            "kind": "float",
            "label": "Color: Background Green",
            "section": "Color",
            "default": 0.04,
            "range": {
              "min": 0.0,
              "max": 1.0,
              "step": 0.01
            }
          },
          {
            "id": "bgColorR",
            "kind": "float",
            "label": "Color: Background Red",
            "section": "Color",
            "default": 0.02,
            "range": {
              "min": 0.0,
              "max": 1.0,
              "step": 0.01
            }
          },
          {
            "id": "colorB",
            "kind": "float",
            "label": "Color: Blue",
            "section": "Color",
            "default": 1.0,
            "range": {
              "min": 0.0,
              "max": 1.0,
              "step": 0.01
            }
          },
          {
            "id": "colorG",
            "kind": "float",
            "label": "Color: Green",
            "section": "Color",
            "default": 0.78,
            "range": {
              "min": 0.0,
              "max": 1.0,
              "step": 0.01
            }
          },
          {
            "id": "colorR",
            "kind": "float",
            "label": "Color: Red",
            "section": "Color",
            "default": 0.12,
            "range": {
              "min": 0.0,
              "max": 1.0,
              "step": 0.01
            }
          },
          {
            "id": "gain",
            "kind": "float",
            "label": "Force: Sensor Gain",
            "section": "Force",
            "default": 0.62,
            "range": {
              "min": 0.0,
              "max": 2.0,
              "step": 0.01
            },
            "units": "multiplier"
          },
          {
            "id": "speedInput",
            "kind": "float",
            "label": "Input: Speed",
            "section": "Input",
            "default": 0.0,
            "range": {
              "min": 0.0,
              "max": 1.0,
              "step": 0.001
            }
          },
          {
            "id": "xInput",
            "kind": "float",
            "label": "Input: X",
            "section": "Input",
            "default": 0.5,
            "range": {
              "min": 0.0,
              "max": 1.0,
              "step": 0.001
            }
          },
          {
            "id": "yInput",
            "kind": "float",
            "label": "Input: Y",
            "section": "Input",
            "default": 0.5,
            "range": {
              "min": 0.0,
              "max": 1.0,
              "step": 0.001
            }
          },
          {
            "id": "rotationDeg",
            "kind": "float",
            "label": "Motion: Rotation",
            "section": "Motion",
            "default": 0.0,
            "range": {
              "min": -180.0,
              "max": 180.0,
              "step": 1.0
            },
            "units": "deg"
          },
          {
            "id": "speed",
            "kind": "float",
            "label": "Motion: Speed",
            "section": "Motion",
            "default": 0.65,
            "range": {
              "min": 0.0,
              "max": 4.0,
              "step": 0.01
            },
            "units": "multiplier"
          },
          {
            "id": "scale",
            "kind": "float",
            "label": "Scale: Size",
            "section": "Scale",
            "default": 0.82,
            "range": {
              "min": 0.1,
              "max": 2.0,
              "step": 0.01
            },
            "units": "multiplier",
            "options": [
              {
                "value": 0.5,
                "label": "Compact",
                "description": "Reduce the layer footprint."
              },
              {
                "value": 0.82,
                "label": "Default",
                "description": "Use the reviewed package scale."
              },
              {
                "value": 1.0,
                "label": "Full",
                "description": "Use the full normalized layer scale."
              }
            ]
          },
          {
            "id": "bpmMultiplier",
            "kind": "float",
            "label": "Time: BPM Multiplier",
            "section": "Time",
            "default": 1.0,
            "range": {
              "min": 0.25,
              "max": 8.0,
              "step": 0.25
            },
            "units": "multiplier",
            "optionsSource": {
              "id": "transport.bpmMultipliers",
              "value": "multiplier",
              "label": "label"
            }
          },
          {
            "id": "bpmSync",
            "kind": "bool",
            "label": "Time: BPM Sync",
            "section": "Time",
            "default": true
          },
          {
            "id": "alpha",
            "kind": "float",
            "label": "Visibility: Alpha",
            "section": "Visibility",
            "default": 0.86,
            "range": {
              "min": 0.0,
              "max": 1.0,
              "step": 0.01
            },
            "deprecated": {
              "replacement": "opacity",
              "reason": "New layers should prefer opacity/visibility naming, but this fixture preserves the current public SDK parameter."
            }
          },
          {
            "id": "lineOpacity",
            "kind": "float",
            "label": "Visibility: Line Opacity",
            "section": "Visibility",
            "default": 0.72,
            "range": {
              "min": 0.0,
              "max": 1.0,
              "step": 0.01
            }
          },
          {
            "id": "visible",
            "kind": "bool",
            "label": "Visibility: Visible",
            "section": "Visibility",
            "default": true
          }
        ]
      },
      "presets": [
        {
          "presetId": "default",
          "label": "Default",
          "path": "presets/default.json"
        },
        {
          "presetId": "bright",
          "label": "Bright",
          "path": "presets/bright.json"
        },
        {
          "presetId": "calm",
          "label": "Calm",
          "path": "presets/calm.json"
        }
      ],
      "presetBanks": [
        {
          "id": "performance",
          "label": "Performance",
          "presets": [
            "default",
            "bright",
            "calm"
          ]
        }
      ],
      "mappingPresets": [
        {
          "id": "hostMicMotion",
          "label": "Host Mic Motion",
          "targets": [
            "gain",
            "speedInput"
          ],
          "patterns": [
            "/sensor/host/localmic/mic-level",
            "/sensor/host/localmic/mic-bass"
          ]
        }
      ]
    },
    {
      "assetId": "examples.generated_models.tetrahedron",
      "label": "Tetrahedron Fixture",
      "category": "Generated",
      "layerGroup": "Models",
      "kind": "generated-content-layer",
      "layerType": "model.stlViewer",
      "registryPrefix": "examples.generated_models.tetrahedron",
      "source": {
        "kind": "generated-content",
        "templateId": "templates.model.stl",
        "templatePath": "docs/examples/generated_layers/stl_models/generated_layer.template.json",
        "strategy": "template-generated"
      },
      "inspection": {
        "manifestInspectionOnly": true,